{
  "contract": "findings.v1",
  "fixture": true,
  "campaignId": "fixture-campanha-01",
  "runId": "fixture-run-sem-01",
  "receivedAt": "2026-01-03T00:10:30Z",
  "receipt": "recibo-fixture-02",
  "findingContract": "achado-2",
  "report": {
    "timestamp": "2026-01-03T00:10:29Z",
    "model": "modelo-fixture",
    "appUrl": "http://127.0.0.1:3100/fixture.html",
    "scope": [
      "tela fixture inteira"
    ],
    "notes": "FIXTURE SINTÉTICA — não é dado científico; escopo limpo",
    "findings": []
  }
}
